<?XML VERSION="1.0"?>

<!DOCTYPE MODE SYSTEM "xmode.dtd">

<MODE NAME="macro">
	<PROPS>
		<PROPERTY NAME="label" VALUE="jEdit Macro" />
		<PROPERTY NAME="filenameGlob" VALUE="*.macro" />
	</PROPS>
	<RULES>
		<WHITESPACE> </WHITESPACE>
		<WHITESPACE>	</WHITESPACE>
		<EOL_SPAN TYPE="COMMENT1" AT_LINE_START="TRUE">#</EOL_SPAN>
		<EOL_SPAN TYPE="LITERAL1">@</EOL_SPAN>
	</RULES>
</MODE>
