<?xml version="1.0"?>

<!DOCTYPE MODE SYSTEM "xmode.dtd">

<MODE NAME="dsssl">
	<PROPS>
		<PROPERTY NAME="commentStart" VALUE="&lt;!--" />
		<PROPERTY NAME="commentEnd" VALUE="--&gt;" />
		<PROPERTY NAME="boxComment" VALUE="--" />
		<PROPERTY NAME="blockComment" VALUE=";" />
		<PROPERTY NAME="filenameGlob" VALUE="*.{dsl,dsssl}" />
	</PROPS>
	<RULES IGNORE_CASE="TRUE">
		<!-- whitespace: (space and tab) -->
		<WHITESPACE> </WHITESPACE>
		<WHITESPACE>	</WHITESPACE>

		<!-- SGML comment -->
		<SPAN TYPE="COMMENT1">
			<BEGIN>&lt;!--</BEGIN>
			<END>--&gt;</END>
		</SPAN>

		<!-- DTD Entity declarations -->
		<SPAN TYPE="KEYWORD2" DELEGATE="xml::ENTITY-TAGS">
			<BEGIN>&lt;!ENTITY</BEGIN>
			<END>&gt;</END>
		</SPAN>

		<!-- CDATA sections -->
		<SPAN TYPE="KEYWORD2" DELEGATE="xml::CDATA">
			<BEGIN>&lt;![CDATA[</BEGIN>
			<END>]]&gt;</END>
		</SPAN>

		<!-- DTD instructions -->
		<SPAN TYPE="KEYWORD2" DELEGATE="xml::DTD-TAGS">
			<BEGIN>&lt;!</BEGIN>
			<END>&gt;</END>
		</SPAN>

		<!-- PI directives -->
		<SPAN TYPE="KEYWORD3">
			<BEGIN>&lt;?</BEGIN>
			<END>?&gt;</END>
		</SPAN>

		<!-- DSSSL code -->
		<SPAN TYPE="MARKUP" DELEGATE="lisp::MAIN">
			<BEGIN>&lt;STYLE-SPECIFICATION-BODY</BEGIN>
			<END>&lt;/STYLE-SPECIFICATION-BODY&gt;</END>
		</SPAN>

		<!-- markup tags -->
		<SPAN TYPE="MARKUP" DELEGATE="xml::TAGS">
			<BEGIN>&lt;</BEGIN>
			<END>&gt;</END>
		</SPAN>

		<!-- SGML entities -->
		<SPAN TYPE="LITERAL2" NO_WORD_BREAK="TRUE">
			<BEGIN>&amp;</BEGIN>
			<END>;</END>
		</SPAN>
	</RULES>
</MODE>
